{
  "schemaVersion": "1.0.0",
  "profileId": "profile_local_draft",
  "contact": {
    "legalName": "",
    "preferredName": "",
    "email": "",
    "phone": "",
    "address": {
      "line1": "",
      "line2": "",
      "city": "",
      "state": "",
      "postalCode": "",
      "country": "US"
    }
  },
  "workHistory": [],
  "education": [],
  "certifications": [],
  "skills": [],
  "links": [],
  "truthRules": {
    "neverClaim": [],
    "requiresConfirmation": [],
    "notes": ""
  },
  "metadata": {
    "createdAt": "",
    "updatedAt": "",
    "sourceResumeId": ""
  }
}

